id,body,trans_match,subreddit,post,link
ey114g3,"Yeah i fucking hate faggots. How is that being an edgelord. Let me tell you about the real world kid

Most people dont like fags in the real world","<_sre.SRE_Match object; span=(20, 26), match='faggot'>",teenagers,r/teenagers,/r/teenagers/comments/cuzxh0/holy_shit/ey114g3/
ey120v3,"Your post has been removed because it is not formatted properly.Tag images with the gender of the subjects [M] for male, [F] for female, [CD] for cross dressers, [TW] for trans women, [TM] for trans men or simply [F] and [M] if you prefer. Correct formats can be found [here](https://www.reddit.com/r/BDSMGW/wiki/index).

*I am a bot, and this action was performed automatically. Please [contact the moderators of this subreddit](/message/compose/?to=/r/BDSMGW) if you have any questions or concerns.*","<_sre.SRE_Match object; span=(171, 182), match='trans women'>",BDSMGW,A place to post your own kinky pictures,reddit.com/r/BDSMGW/comments/cv0i5d/i_love_red_marks_on_my_ass_f/ey120v3/
ey126lm,Trans women are real women.,"<_sre.SRE_Match object; span=(0, 11), match='Trans women'>",Drama,the known anti-Semitic hate subreddit r/drama,reddit.com/r/Drama/comments/cuvbqb/white_women_fuck_dogs/ey126lm/
ey128g4,"They're pretty close to equal. In [this 2015 survey](https://transequality.org/sites/default/files/docs/usts/USTS-Full-Report-Dec17.pdf) of trans people in the United States, 29% of respondents were trans men and 33% were trans women. You may be surprised to find that the largest group, at 35% of the respondents, was nonbinary people.","<_sre.SRE_Match object; span=(199, 208), match='trans men'>",asktransgender,asktransgender: questions and comments,reddit.com/r/asktransgender/comments/cv0119/are_there_equal_numbers_of_trans_men_and_trans/ey128g4/
ey12acv,"""Transgenderism"" is the trans equivalent of ""the gay agenda""","<_sre.SRE_Match object; span=(1, 12), match='Transgender'>",ForwardsFromKlandma,"When they're not Grandma, but also not quite Hitler",reddit.com/r/ForwardsFromKlandma/comments/cuvcij/ben_has_completely_lost_it/ey12acv/
ey12dek,Oh know some libtarded faggot used the wrong your while arguing online what a fucking loser,"<_sre.SRE_Match object; span=(23, 29), match='faggot'>",teenagers,r/teenagers,reddit.com/r/teenagers/comments/cuzxh0/holy_shit/ey12dek/
ey12gcn,"It isn't limited to political subreddits either I got a first and only warning in a gaming subreddit for saying nigger. Why did I say it? I was talking about how I was an admin on a popular TF2 server and we had to keep banning people for calling each other nigger and faggot. When I asked the mods what in the hell their response was something along the lines of ""Context doesn't matter! Consider yourself warned.""  

The right does this behavior as well occasionally (I know of for sure one location based subreddit run by a right wing version of this) but it is a lot more rare. 

Apparently being the equivalent of an unpaid internet janitor attracts people with a massive power complex who should never be in power who would have known.","<_sre.SRE_Match object; span=(269, 275), match='faggot'>",TrueReddit,Reddit as it is meant to be,reddit.com/r/TrueReddit/comments/cufylq/reddit_cofounder_alexis_ohanian_we_need_more/ey12gcn/
ey12gd6,"* don't split your 4tags with punctuation (e.g. '4t/CD/sis'). If you're open to more than one gender, please use '4**A**'. If you're looking for a couple, try '4**MF**'. [More...](http://www.reddit.com/r/RandomActsOfBlowJob/wiki/public/tagging/V2 ""If you're open to anyone but have a preference you may use 4t/A'; if you're particularly open to transgender, you can use '4t/T' (or '/TF', '/TM', '/M2F' or '/F2M' as appropriate) or if you'll also consider couples, use '4t/MF."").

____

*I am a bot, and this action was performed automatically. Please [contact the moderators of this subreddit](/message/compose/?to=/r/RandomActsOfBlowJob) if you have any questions or concerns.*","<_sre.SRE_Match object; span=(345, 356), match='transgender'>",RandomActsOfBlowJob,RAOB. Matching mouths and members,reddit.com/r/RandomActsOfBlowJob/comments/cv0k70/27_m4tcdsis_tampa/ey12gd6/
ey12hhl,"Syrians had a 3 months extension. The transgender woman could choose to go back to regime lands before she waited to be sent back

Yes it is not worth arguing with you","<_sre.SRE_Match object; span=(38, 49), match='transgender'>",syriancivilwar,Syria's Civil War (2011—ongoing),reddit.com/r/syriancivilwar/comments/cuwqgx/turkey_deports_syrian_transgender_woman_to_idlib/ey12hhl/
ey12ize,"It isn't, at least not now and not in the foreseeable future.

There is a distinction between *sex* (as in, biological organs, and XX / XY chromosomes) and *gender* (which is the sociological / psychological aspect).

Transgender people are just that: their gender doesn't align with their biological sex.","<_sre.SRE_Match object; span=(218, 229), match='Transgender'>",syriancivilwar,Syria's Civil War (2011—ongoing),reddit.com/r/syriancivilwar/comments/cuwqgx/turkey_deports_syrian_transgender_woman_to_idlib/ey12ize/
ey1354m,"In what way is this forcing a gender identity on anyone?

It’s not *my* character. It’s a character in the Borderlands universe. I am not forced to play as them. I can choose another character that corresponds to the gender of my choice if that is something that matters to me.

Furthermore, misgendering a character, learning that you’ve done so and then not doing it again is fine. If you intentionally misgender someone as a joke or a meme though... you’re the asshole!","<_sre.SRE_Match object; span=(30, 45), match='gender identity'>",Gamingcirclejerk,Gaming Circlejerk - Home of CD Projekt Red,reddit.com/r/Gamingcirclejerk/comments/cv0ecs/dont_identify_your_character_how_you_want_others/ey1354m/
ey135k7,ur a faggot,"<_sre.SRE_Match object; span=(5, 11), match='faggot'>",teenagers,r/teenagers,reddit.com/r/teenagers/comments/cuhdin/despite_being_13_percent_of_the_population/ey135k7/
ey1365e,"Bottom surgery is still in development and to be honest I've been told a lot can go wrong with it, because of this and other reasons a lot of trans men opt out of it but if your bottom dysphoria is that bad then it is a possibility. Personally, I don't want bottom surgery since there are alternatives and it could go wrong. Another thing I've heard is that you either end up with a penis that's small or doesn't have much sensitivity. But again I haven't had it so I do not know. Ask a doctor or people who have had it and they'll tell you if it's best or not","<_sre.SRE_Match object; span=(142, 151), match='trans men'>",ftm,A place for the guys.,reddit.com/r/ftm/comments/cv01wr/i_want_to_transition_but_there_are_a_few_things/ey1365e/
ey13ycq,"hot topic sa office ang sogie bill. it started with me talking to a cute mom of 3 about our stand on the issue. Im okay with it, shes against it. Next thing i know, im talking to 14 peeps that are not for it. and i am overwhelmed by the fact that i was alone on the pro side.  It's okay tho. Things they worried about are:

&#x200B;

* can sue anyone as long as an lgbt feels discriminated e.g. schools that dont allow a trans to dress what he/she wants, or church that doesnt allow one to be a clergy etc
* and because of that institutions need to adjust
* makes gay marriage legal (next)
* transexuals are still men, why use women cr

&#x200B;

Besides some comments that its a trash bill cos its Hontiveros',(i tell em it MDS', and i get ""oh""), or since im straight and has a long hair, i can just go to womens cr and peep (lol), its all good.","<_sre.SRE_Match object; span=(592, 602), match='transexual'>",Philippines,Philippines - all about the Philippines,reddit.com/r/Philippines/comments/cuzoob/daily_random_discussion_aug_25_2019/ey13ycq/
ey142by,"As a Libertarian, what if I identify as a teenage girl?",,SubredditDrama,Popcorn tastes good.,reddit.com/r/SubredditDrama/comments/cus8d4/raskteengirls_mods_bans_boys_from_answering/ey142by/
ey14a8z,"* 'Mfm' isn't valid. [More...](http://www.reddit.com/r/RandomActsOfBlowJob/wiki/public/tagging/V2 ""Exceptions: to show a preference, '{{match-title#firsttag-3}}4{{match-title#firsttag-4}}/A' (anyone); '{{match-title#firsttag-3}}4{{match-title#firsttag-4}}/T' (or '/TF' & '/TM' as appropriate) for transgender, or {{match-title#firsttag-3}}4{{match-title#firsttag-4}}/MF for couples."") 

____

*I am a bot, and this action was performed automatically. Please [contact the moderators of this subreddit](/message/compose/?to=/r/RandomActsOfBlowJob) if you have any questions or concerns.*","<_sre.SRE_Match object; span=(297, 308), match='transgender'>",RandomActsOfBlowJob,RAOB. Matching mouths and members,reddit.com/r/RandomActsOfBlowJob/comments/cv0snd/mfm_18_bi_curious_guy_want_to_know_about_gay/ey14a8z/
ey14b3i,"Also less than 1%, but not the same ""less than 1%"" (though there is likely some overlap).  If transgender correlated strongly with intersex, there'd be far less of a culture war over it, I think.","<_sre.SRE_Match object; span=(94, 105), match='transgender'>",TheMotte,The Motte,reddit.com/r/TheMotte/comments/csclze/culture_war_roundup_for_the_week_of_august_19_2019/ey14b3i/
ey14fd0,"it's like a magic trick, i just say the word nonbinary and presto somebody appears who's got a problem with me lmao

I am not a female bro but I support all female bros","<_sre.SRE_Match object; span=(45, 54), match='nonbinary'>",gainit,We're all gonna make it,reddit.com/r/gainit/comments/cuo4pt/can_women_post_here_or_is_it_male_only/ey14fd0/
ey14n20,"You’d be surprised how tolerant the south is, I lived in Georgia for 4 years and everyone was supportive of people when they came out, now I live in the “progressive” and “tolerant” state of Rhode Island and have heard people call each other faggots and shit more times than I can count.","<_sre.SRE_Match object; span=(242, 248), match='faggot'>",teenagers,r/teenagers,reddit.com/r/teenagers/comments/cv0rxm/kid_at_my_school_came_out_did_not_end_well/ey14n20/
ey14wl1,"Does he, faggot?

Have you ever had an original thought or do you just like to regurgitate cute little Reddit^TM phrases?","<_sre.SRE_Match object; span=(9, 15), match='faggot'>",4chan,Cheat Engine,reddit.com/r/4chan/comments/cux0g8/fitizen_asks_about_pushups/ey14wl1/
ey14yv5,"This post was about antifa being downtown Portland.  Not proud boys. Had they done the same thing they would be faggots too, just like you you fascist dick riding fuck","<_sre.SRE_Match object; span=(112, 118), match='faggot'>",bestofworldstar,The Best Of World Star Hip-Hop,reddit.com/r/bestofworldstar/comments/csc8g9/not_letting_go_protestors_in_portland_tussle_over/ey14yv5/
ey1525y,I identify as a box,,gmu,George Mason University Subreddit,reddit.com/r/gmu/comments/cv0czz/being_a_vegetarian_at_mason_is_already_becoming_a/ey1525y/
ey1572j,"I definitely get that ""HRT as last resort"" vibe. I see from both perspectives. On the transgender-pride perspective, ""Why hold back hormones if it's so obvious they are the only obvious healthy conclusion?"" but I also see the other side, people reading the book who are wary and just now learning about this stuff, and Yarhouse saying while they may be a last resort, there are very few [if any] desirable alternatives. But I'm only half through the book, and you seem to have encountered him at a speaking thing, so you may know more about his perspective. So far I see it as a great resource for allies/friends/family of transgender persons, not the person them-self. And lastly I have not encoutnered anything against HRT as a solution... it's actually laughable he goes through the hoops to arrive at the conclusion ""If [all these other things] don't work, HRT is the next non-invasive procedure."" I do find it funny how he pairs gender-surgeries with HRT; IMHO surgeries are worlds more invasive to be even comparable to HRT. Also, ... who the hell would get a gender surgery without HRT to back it up? (I say that because sometimes he talks in a way that might be perceived as either/or, but I again might be mistaken)","<_sre.SRE_Match object; span=(86, 97), match='transgender'>",asktransgender,asktransgender: questions and comments,reddit.com/r/asktransgender/comments/cujpkh/a_divine_intervention_by_god/ey1572j/
ey15car,"I identify as soy 

FUCK TRUMP! FUCK WHITE PEOPLE!",,gmu,George Mason University Subreddit,reddit.com/r/gmu/comments/cv0czz/being_a_vegetarian_at_mason_is_already_becoming_a/ey15car/
ey15d6r,"The truth is, you cannot possibly know that. Maybe that’s the case or maybe it isn’t. Further information is required in order to constitute that. It’s possible that she pledged extra asylum because of her identity and got denied ,and on other hand it’s plausible that she was deported because of her legal status. 

But considering the world wide discrimination and extreme-violence (even in progressive countries like Sweden) towards transgendered people it isn’t so unlikely. But the truth is, further information is requested to constitute the motivation behind her deportation which isn’t available.","<_sre.SRE_Match object; span=(436, 447), match='transgender'>",syriancivilwar,Syria's Civil War (2011—ongoing),reddit.com/r/syriancivilwar/comments/cuwqgx/turkey_deports_syrian_transgender_woman_to_idlib/ey15d6r/
ey15gl4,"Somehow I get the feeling that no matter how much i try and explain it as best I can, I'll be painted into some corner with semantics and rhetoric, which is something I'm all too familiar with in this continuous sphere of debate.

For the last time I will say, transgender is merely overly expensive cosmetic surgery, a man will never be a woman, a woman will never be a man, there is no genderfluidity, you either are or you aren't. That's just how I see it.","<_sre.SRE_Match object; span=(261, 272), match='transgender'>",unpopularopinion,For Your Opinions That Are Unpopular ,reddit.com/r/unpopularopinion/comments/c5tr4n/lgbtq_megathread/ey15gl4/
ey15o6u,"Nah dr.conway and sybil are real people. 

It's likely that that program 'YAVA' logs people inside those folders you see fletcher go through, so furniture, people etc... are logged in those folders. 

So one can assume that since the program keeps crashing over and over again some stuff glitches out, corrupts and is deleted along the way, that could explain why the furniture in the living room suddenly disappeared or how dr.conway is able to teleport from place to place, because his file is moving all over the place. 

another thing I noticed is that the only three MTF's that were killed happened to be the ones that were messing with the code or checking it out or whatever. 

O'neil was with fletcher when he said 'cardoon' which could have been the reason why they were both specifically targeted at the end and west dying trying to read that code on the wall.","<_sre.SRE_Match object; span=(572, 575), match='MTF'>",SCP,The SCP Foundation,reddit.com/r/SCP/comments/cuwiwh/scp_dollhouse/ey15o6u/
ey15opg,Girl love your makeup. You look super cute. (Chloe mtf ),"<_sre.SRE_Match object; span=(51, 54), match='mtf'>",MTFSelfieTrain,MTF Selfie Train,reddit.com/r/MTFSelfieTrain/comments/cv0288/hi_hi_28_months_hrt/ey15opg/
ey15q2r,"faggot

hi gary","<_sre.SRE_Match object; span=(0, 6), match='faggot'>",wsgy,FUCK OFF,reddit.com/r/wsgy/comments/cuunpt/one_of_the_ladies_at_work_absolutely_does_not/ey15q2r/
ey16ev8,"Using the word ""problematic"" in that context is a problem. I think they do need to seriously think about surgery and actually have it in order to be a legitimately trans person. Do they deserve any harm that might come to them, trans or not? No. ""Non-binary"" - just choose one. It's not that difficult.

Nobody uses ""performative"" in that way, either, mainly because nobody will know what that means. You should have stopped at ""fake.""","<_sre.SRE_Match object; span=(247, 257), match='Non-binary'>",TwoXChromosomes,You are the community. You have all the power of the internet to mold it..,reddit.com/r/TwoXChromosomes/comments/cuoq66/i_always_try_my_best_to_compliment_other_women/ey16ev8/
ey16hw1,Some of those MTF vaginas are terrible  and border line medical malpractice honestly (I’m assuming not all of them),"<_sre.SRE_Match object; span=(14, 17), match='MTF'>",starterpacks,Starterpacks,reddit.com/r/starterpacks/comments/cuwcvs/antilgbt_reddit_post_starter_pack/ey16hw1/
ey16kih,Looooool what a dumb faggot,"<_sre.SRE_Match object; span=(21, 27), match='faggot'>",TigerBelly,Tiger Belly,reddit.com/r/TigerBelly/comments/cuyk8r/erik_griffin_is_a_bitch/ey16kih/
ey16lxf,"Transgender people who are supported by friends and family before during and after transitioning have the same levels of depression and suicide as the general population. It's only trans people who are shunned for transitioning that retain high suicide rates. How about you let people be, and stop acting as if you have a say in what gender and sex people identify as. Or maybe you'd like it if the government decided to mark you down as the opposite sex one day, and refused to change it.","<_sre.SRE_Match object; span=(0, 11), match='Transgender'>",Shuffles_Deck,Shuffles Deck,reddit.com/r/Shuffles_Deck/comments/cui16i/damn_white_people_and_their_shuffles_cards_not/ey16lxf/
ey175lg,"In Canada, Jonathan Yaniv is the direct result of this system: an appropriator who is consciously using the legal protections granted to him virtue of his self-ID to get into positions where he can act upon his sexual fantasies -- all behind a legal smokescreen.

I hate the self-ID movement with a passion. It's absolute lunacy, it benefits only the trenders and fetishists and hurts the actual transsexuals (including those who advocate for it), and it's a core position of mainstream transactivism. ""If you say you're trans, you're trans! Fuck the corrupt doctors and bully your endos into giving you 10mg of E every day.""

You'll get called truscum for claiming otherwise.

I don't know if this is limited to the online trans community, because I don't really associate with the trans community IRL. But god, it's not only annoying but *outright dangerous* to allow anyone to claim ""transhood"". With every country that brings self-ID to the letter of the law, there will be Jonathan Yanivs using it to abuse and sexually harass other people. There will be people with long and storied histories of pedophilia and sexual abuse, who the police will not touch because they're trans. (it is *mind-numbing* how JY has not been arrested yet -- oh yeah, he *did* get arrested for brandishing a taser on stream but was mysteriously released just about 5 seconds later)

End it all. Self-ID is dangerous and should never have even become a possibility of discussion. I believe we have a self-ID law here in California that's been in effect for a few months. And I'm just waiting to feel the fallout of it.","<_sre.SRE_Match object; span=(396, 407), match='transsexual'>",truscum,/r/truscum: Because being trans means something,reddit.com/r/truscum/comments/cuvc4s/who_else_doesnt_want_the_legal_gender_change/ey175lg/
ey175z6,That’s helephobic my gender is attack helicopter and you can’t change that,"<_sre.SRE_Match object; span=(31, 48), match='attack helicopter'>",teenagers,r/teenagers,reddit.com/r/teenagers/comments/cv0y97/theres_only_two_genders/ey175z6/
